{
    "$schema": "http://json-schema.org/draft-07/schema#",
    "title": "GitDiff2Docx Configuration",
    "description": "Configuration schema for the GitDiff2Docx tool that converts git diffs to Word documents",
    "type": "object",
    "required": [
        "language"
    ],
    "properties": {
        "$schema": {
            "type": "string",
            "description": "Meta-schema reference"
        },
        "language": {
            "type": "string",
            "description": "The language code for localization (e.g., 'de' for German)",
            "examples": ["de", "en", "fr"]
        },
        "verbose": {
            "type": "boolean",
            "description": "Enable verbose output for detailed logging",
            "default": true
        },
        "theme": {
            "type": "string",
            "description": "Name of the theme file in the themes folder (without .json)",
            "default": "classic",
            "examples": ["classic", "modern", "modern-atlas", "modern-carbon", "modern-sand", "modern-dark"]
        },
        "diff_font": {
            "type": "string",
            "description": "Font family to use for diff content in the Word document",
            "default": "Courier New"
        },
        "diff_font_size": {
            "type": "integer",
            "description": "Font size for diff content in the Word document",
            "minimum": 6,
            "maximum": 72,
            "default": 8
        },
        "open_after_creation": {
            "type": "boolean",
            "description": "Whether to open the generated Word document after creation",
            "default": true
        },
        "heading_level": {
            "type": "integer",
            "description": "Heading level for file sections in the Word document",
            "minimum": 1,
            "maximum": 9,
            "default": 3
        },
        "file_encoding": {
            "type": "string",
            "description": "Character encoding for reading and writing files",
            "default": "utf-8"
        },
        "include_first_commit": {
            "type": "boolean",
            "description": "Whether to include the first commit in the diff analysis",
            "default": true
        },
        "gdd_ignore_file_name": {
            "type": "string",
            "description": "Name of the ignore file for excluding certain files from the diff analysis",
            "default": ".gddignore"
        },
        "include_unchanged_lines": {
            "type": "boolean",
            "description": "Whether to include unchanged lines in the diff output",
            "default": true
        },
        "include_images": {
            "type": "boolean",
            "description": "Whether to include images in the diff output",
            "default": true
        },
        "insert_page_breaks": {
            "type": "boolean",
            "description": "Whether to insert page breaks between sections in the Word document",
            "default": true
        }
    },
    "additionalProperties": false
}
